{
  "schema_version": 1,
  "run_id": "codex-claim-release-full-aggregation-open-band-stage-timing-v1",
  "step_index": 1,
  "accepted_utc": "2026-03-31T04:26:15.9957542Z",
  "compat": {
    "ast_schema_hash": "blake3:fc9be9ae20ab7277941ba7c98fcb9b7b0a78f699e595d3268656144a3f0b21bf",
    "type_rules_hash": "blake3:39c261a0e90bde0cfa2affee542db9a2519e4b8cd95c008e3fa0ed59cd38ac2e",
    "evaluator_hash": "blake3:dc3ad0d7c757a4b498bd4cfc56446e05af84df38049161883ab8592b18df4792",
    "search_semantics_hash": "blake3:f3572c8c8c9e01202de7df3840fda6eb4458c2f10104b509a36610d2f6dc80ea"
  },
  "objective": {
    "bar": {
      "num": 1,
      "den": 2
    },
    "exact_clause_kappa": 2,
    "bit_band": {
      "min": 14,
      "max": 14
    }
  },
  "accepted": {
    "candidate_hash": "blake3:61631d63a5877aad1b32b1e71aa6f0e555317b65732f327e3f38e32c222e29e7",
    "canonical_hash": "blake3:23ab301fcb806f4f151974b767119ea66f8ee39bcf5b7d9c95924fc2902663b2",
    "bit_kappa": 14,
    "clause_kappa": 2,
    "nu": 1,
    "rho": {
      "num": 1,
      "den": 2
    },
    "overshoot": {
      "num": 0,
      "den": 1
    },
    "shape_fingerprint": "0x350279ac226f6f9e",
    "support_fingerprint": "0x87094c2e0eb8d3ae"
  },
  "library_snapshot": {
    "window_depth": 2,
    "entries": []
  },
  "near_misses": [],
  "stats": {
    "frontier_scanned": 1,
    "typed_prefixes": 1,
    "sound_prunes": 0,
    "heuristic_drops": 0
  }
}
