{
  "schema_version": 1,
  "run_id": "codex-demo-midstep-carrythrough",
  "step_index": 4,
  "accepted_utc": "2026-03-17T19:20:20.5415465Z",
  "compat": {
    "ast_schema_hash": "blake3:fc9be9ae20ab7277941ba7c98fcb9b7b0a78f699e595d3268656144a3f0b21bf",
    "type_rules_hash": "blake3:39c261a0e90bde0cfa2affee542db9a2519e4b8cd95c008e3fa0ed59cd38ac2e",
    "evaluator_hash": "blake3:dc3ad0d7c757a4b498bd4cfc56446e05af84df38049161883ab8592b18df4792",
    "search_semantics_hash": "blake3:f3572c8c8c9e01202de7df3840fda6eb4458c2f10104b509a36610d2f6dc80ea"
  },
  "objective": {
    "bar": {
      "num": 3,
      "den": 2
    },
    "exact_clause_kappa": 3,
    "bit_band": {
      "min": 49,
      "max": 49
    }
  },
  "accepted": {
    "candidate_hash": "blake3:2016726758f30ee3f1dc73b5e89388f2c5d0f6059cd2c3a82aaa01f2b89a3407",
    "canonical_hash": "blake3:c7a99c10bbc01197aec9fa0c4605b4763dda6dc22ea95310fae37e9ff5ee65a1",
    "bit_kappa": 49,
    "clause_kappa": 3,
    "nu": 5,
    "rho": {
      "num": 5,
      "den": 3
    },
    "overshoot": {
      "num": 1,
      "den": 6
    },
    "shape_fingerprint": "0xfd47801ec06d6c37",
    "support_fingerprint": "0xf6144ff1106fac0d"
  },
  "library_snapshot": {
    "window_depth": 2,
    "entries": [
      {
        "step": 2,
        "candidate_hash": "blake3:a2dfff0fb8ce1073119da3893e1d195247c234af66b9a7de17c85d5cf718f555",
        "telescope": {
          "clauses": [
            {
              "role": "formation",
              "expr": {
                "App": [
                  "Univ",
                  {
                    "Var": 1
                  }
                ]
              }
            }
          ]
        }
      },
      {
        "step": 3,
        "candidate_hash": "blake3:934b5599bb0f28abf0be9652982caec5e0ff6d7d204ddaa4e66f23c37155457e",
        "telescope": {
          "clauses": [
            {
              "role": "introduction",
              "expr": {
                "App": [
                  {
                    "Lib": 2
                  },
                  {
                    "Var": 1
                  }
                ]
              }
            }
          ]
        }
      }
    ]
  },
  "near_misses": [
    {
      "candidate_hash": "blake3:e80f1b97ffc005ecf1634be09a8d38f384eb3574eebd84d6a5b58f1349a15e8f",
      "canonical_hash": "blake3:45cf7046afca0a242d766054336b613bb16f19be49233fac8aa97cc20e344f0e",
      "bit_kappa": 53,
      "clause_kappa": 3,
      "nu": 5,
      "status": "bar_clear_higher_overshoot"
    },
    {
      "candidate_hash": "blake3:f2f8e24cdeb39fe90c5fce7ab42c2dbdd73556707f0362777d7358a6c10c7ef1",
      "canonical_hash": "blake3:dfbcb35d49d92f61fb5c1ace256a1bfa7b8469fb8270fde1ecee0d9fc6c95793",
      "bit_kappa": 52,
      "clause_kappa": 3,
      "nu": 5,
      "status": "bar_clear_higher_overshoot"
    },
    {
      "candidate_hash": "blake3:6d05faeb2cb5d76bb5945b97ce029e56c2dd236da8efb270d3b483999001a145",
      "canonical_hash": "blake3:6c7d786f1b947c22b3cb3df4cb3945958f1dce5c517d74208deaeabd0f09693e",
      "bit_kappa": 50,
      "clause_kappa": 3,
      "nu": 5,
      "status": "bar_clear_higher_overshoot"
    }
  ],
  "stats": {
    "frontier_scanned": 24,
    "typed_prefixes": 24,
    "sound_prunes": 0,
    "heuristic_drops": 0
  }
}
