{
  "schema_version": 1,
  "run_id": "codex-claim-release-full-aggregation-open-band-clause-accept-rank-facts-long-rerun-v6",
  "step_index": 4,
  "accepted_utc": "2026-04-04T20:39:46.4411755Z",
  "compat": {
    "ast_schema_hash": "blake3:fc9be9ae20ab7277941ba7c98fcb9b7b0a78f699e595d3268656144a3f0b21bf",
    "type_rules_hash": "blake3:39c261a0e90bde0cfa2affee542db9a2519e4b8cd95c008e3fa0ed59cd38ac2e",
    "evaluator_hash": "blake3:dc3ad0d7c757a4b498bd4cfc56446e05af84df38049161883ab8592b18df4792",
    "search_semantics_hash": "blake3:f3572c8c8c9e01202de7df3840fda6eb4458c2f10104b509a36610d2f6dc80ea"
  },
  "objective": {
    "bar": {
      "num": 3,
      "den": 2
    },
    "exact_clause_kappa": 3,
    "bit_band": {
      "min": 49,
      "max": 49
    }
  },
  "accepted": {
    "candidate_hash": "blake3:2016726758f30ee3f1dc73b5e89388f2c5d0f6059cd2c3a82aaa01f2b89a3407",
    "canonical_hash": "blake3:c7a99c10bbc01197aec9fa0c4605b4763dda6dc22ea95310fae37e9ff5ee65a1",
    "bit_kappa": 49,
    "clause_kappa": 3,
    "nu": 5,
    "rho": {
      "num": 5,
      "den": 3
    },
    "overshoot": {
      "num": 1,
      "den": 6
    },
    "shape_fingerprint": "0xfd47801ec06d6c37",
    "support_fingerprint": "0xf6144ff1106fac0d"
  },
  "library_snapshot": {
    "window_depth": 2,
    "entries": [
      {
        "step": 2,
        "candidate_hash": "blake3:a2dfff0fb8ce1073119da3893e1d195247c234af66b9a7de17c85d5cf718f555",
        "telescope": {
          "clauses": [
            {
              "role": "formation",
              "expr": {
                "App": [
                  "Univ",
                  {
                    "Var": 1
                  }
                ]
              }
            }
          ]
        }
      },
      {
        "step": 3,
        "candidate_hash": "blake3:934b5599bb0f28abf0be9652982caec5e0ff6d7d204ddaa4e66f23c37155457e",
        "telescope": {
          "clauses": [
            {
              "role": "introduction",
              "expr": {
                "App": [
                  {
                    "Lib": 2
                  },
                  {
                    "Var": 1
                  }
                ]
              }
            }
          ]
        }
      }
    ]
  },
  "near_misses": [],
  "stats": {
    "frontier_scanned": 2,
    "typed_prefixes": 1,
    "sound_prunes": 0,
    "heuristic_drops": 0
  }
}
