{
  "schema_version": 1,
  "run_id": "codex-claim-release-full-aggregation-open-band-clause-accept-rank-facts-long-rerun-v13",
  "step_index": 8,
  "accepted_utc": "2026-04-10T05:57:21.3107567Z",
  "compat": {
    "ast_schema_hash": "blake3:fc9be9ae20ab7277941ba7c98fcb9b7b0a78f699e595d3268656144a3f0b21bf",
    "type_rules_hash": "blake3:39c261a0e90bde0cfa2affee542db9a2519e4b8cd95c008e3fa0ed59cd38ac2e",
    "evaluator_hash": "blake3:dc3ad0d7c757a4b498bd4cfc56446e05af84df38049161883ab8592b18df4792",
    "search_semantics_hash": "blake3:f3572c8c8c9e01202de7df3840fda6eb4458c2f10104b509a36610d2f6dc80ea"
  },
  "objective": {
    "bar": {
      "num": 357,
      "den": 104
    },
    "exact_clause_kappa": 5,
    "bit_band": {
      "min": 37,
      "max": 37
    }
  },
  "accepted": {
    "candidate_hash": "blake3:e01de7b95b0dda56a1062add33387a37709e23d3d6ea6ce4efaf27adacb868c0",
    "canonical_hash": "blake3:c6fc7673d107487f21fb29064e7ce8c9418f9fb2f0688613380e116ea77230aa",
    "bit_kappa": 37,
    "clause_kappa": 5,
    "nu": 18,
    "rho": {
      "num": 18,
      "den": 5
    },
    "overshoot": {
      "num": 87,
      "den": 520
    },
    "shape_fingerprint": "0xb543b1350e85dc3c",
    "support_fingerprint": "0x6d59b877bbaf2f17"
  },
  "library_snapshot": {
    "window_depth": 2,
    "entries": [
      {
        "step": 6,
        "candidate_hash": "blake3:a2ff7bc69a678e8c257824465993f8aadf71c05676562887da12dce3ae6cfe1d",
        "telescope": {
          "clauses": [
            {
              "role": "formation",
              "expr": {
                "Trunc": {
                  "Var": 1
                }
              }
            },
            {
              "role": "introduction",
              "expr": {
                "App": [
                  {
                    "Trunc": {
                      "Var": 1
                    }
                  },
                  {
                    "Var": 2
                  }
                ]
              }
            },
            {
              "role": "path_attach",
              "expr": {
                "PathCon": 1
              }
            }
          ]
        }
      },
      {
        "step": 7,
        "candidate_hash": "blake3:30f190b67aab5179a6de8dccee6c29c699b80c12bef676bf2e9f9377595a7906",
        "telescope": {
          "clauses": [
            {
              "role": "formation",
              "expr": {
                "App": [
                  "Univ",
                  {
                    "Var": 1
                  }
                ]
              }
            },
            {
              "role": "introduction",
              "expr": {
                "Var": 1
              }
            },
            {
              "role": "path_attach",
              "expr": {
                "PathCon": 2
              }
            }
          ]
        }
      }
    ]
  },
  "near_misses": [],
  "stats": {
    "frontier_scanned": 1,
    "typed_prefixes": 1,
    "sound_prunes": 0,
    "heuristic_drops": 0
  }
}
