{
  "schema_version": 1,
  "run_id": "codex-demo-midstep-carrythrough",
  "step_index": 12,
  "accepted_utc": "2026-03-17T19:20:20.5415465Z",
  "compat": {
    "ast_schema_hash": "blake3:fc9be9ae20ab7277941ba7c98fcb9b7b0a78f699e595d3268656144a3f0b21bf",
    "type_rules_hash": "blake3:39c261a0e90bde0cfa2affee542db9a2519e4b8cd95c008e3fa0ed59cd38ac2e",
    "evaluator_hash": "blake3:dc3ad0d7c757a4b498bd4cfc56446e05af84df38049161883ab8592b18df4792",
    "search_semantics_hash": "blake3:f3572c8c8c9e01202de7df3840fda6eb4458c2f10104b509a36610d2f6dc80ea"
  },
  "objective": {
    "bar": {
      "num": 8208,
      "den": 1513
    },
    "exact_clause_kappa": 6,
    "bit_band": {
      "min": 121,
      "max": 121
    }
  },
  "accepted": {
    "candidate_hash": "blake3:0d06e3b14bfd7c1bd16d9f66039e016f84a6162ce85584f7c641753b833b1dcb",
    "canonical_hash": "blake3:fd636363062e2cc44259d330cd96e319979d8ae7ff02eb065599bb2541d03cac",
    "bit_kappa": 121,
    "clause_kappa": 6,
    "nu": 34,
    "rho": {
      "num": 17,
      "den": 3
    },
    "overshoot": {
      "num": 1097,
      "den": 4539
    },
    "shape_fingerprint": "0xb8dbddf0518ad973",
    "support_fingerprint": "0xbd5c4a1091ef1ff5"
  },
  "library_snapshot": {
    "window_depth": 2,
    "entries": [
      {
        "step": 10,
        "candidate_hash": "blake3:93289041755cf4c4e0396029273822630028999d945359b10bb88e2376b9788e",
        "telescope": {
          "clauses": [
            {
              "role": "formation",
              "expr": {
                "Flat": {
                  "Var": 1
                }
              }
            },
            {
              "role": "formation",
              "expr": {
                "Sharp": {
                  "Var": 1
                }
              }
            },
            {
              "role": "formation",
              "expr": {
                "Disc": {
                  "Var": 1
                }
              }
            },
            {
              "role": "formation",
              "expr": {
                "Shape": {
                  "Var": 1
                }
              }
            }
          ]
        }
      },
      {
        "step": 11,
        "candidate_hash": "blake3:03cc71839428ceab088e386e31e6c72b7ca4a1e12c9309557efc76826dcb88cd",
        "telescope": {
          "clauses": [
            {
              "role": "formation",
              "expr": {
                "Pi": [
                  {
                    "Lib": 10
                  },
                  {
                    "Pi": [
                      {
                        "Var": 1
                      },
                      {
                        "Var": 1
                      }
                    ]
                  }
                ]
              }
            },
            {
              "role": "introduction",
              "expr": {
                "Lam": {
                  "Pi": [
                    {
                      "Var": 1
                    },
                    {
                      "Var": 2
                    }
                  ]
                }
              }
            },
            {
              "role": "formation",
              "expr": {
                "Pi": [
                  {
                    "Flat": {
                      "Var": 1
                    }
                  },
                  {
                    "Var": 1
                  }
                ]
              }
            },
            {
              "role": "introduction",
              "expr": {
                "App": [
                  {
                    "Lib": 10
                  },
                  {
                    "Var": 1
                  }
                ]
              }
            },
            {
              "role": "introduction",
              "expr": {
                "Lam": {
                  "Var": 1
                }
              }
            }
          ]
        }
      }
    ]
  },
  "near_misses": [],
  "stats": {
    "frontier_scanned": 41,
    "typed_prefixes": 2,
    "sound_prunes": 82,
    "heuristic_drops": 0
  }
}
