{
  "schema_version": 1,
  "run_id": "codex-demo-step15-bridge-widening",
  "step_index": 13,
  "accepted_utc": "2026-03-17T15:27:29.2398253Z",
  "compat": {
    "ast_schema_hash": "blake3:fc9be9ae20ab7277941ba7c98fcb9b7b0a78f699e595d3268656144a3f0b21bf",
    "type_rules_hash": "blake3:39c261a0e90bde0cfa2affee542db9a2519e4b8cd95c008e3fa0ed59cd38ac2e",
    "evaluator_hash": "blake3:dc3ad0d7c757a4b498bd4cfc56446e05af84df38049161883ab8592b18df4792",
    "search_semantics_hash": "blake3:f3572c8c8c9e01202de7df3840fda6eb4458c2f10104b509a36610d2f6dc80ea"
  },
  "objective": {
    "bar": {
      "num": 8621,
      "den": 1440
    },
    "exact_clause_kappa": 7,
    "bit_band": {
      "min": 138,
      "max": 138
    }
  },
  "accepted": {
    "candidate_hash": "blake3:b09b3f832bef16953747c213e6b8a548f594339dc7db9148e7ae60a6c53a4cf1",
    "canonical_hash": "blake3:4eefcc446fb659c101cb538dcf4b06695c165d6e977e64ab7580a2451af0f5ae",
    "bit_kappa": 138,
    "clause_kappa": 7,
    "nu": 46,
    "rho": {
      "num": 46,
      "den": 7
    },
    "overshoot": {
      "num": 5893,
      "den": 10080
    },
    "shape_fingerprint": "0x8ddda2c8fe61c46d",
    "support_fingerprint": "0x2a6d5c46e2f476f3"
  },
  "library_snapshot": {
    "window_depth": 2,
    "entries": [
      {
        "step": 11,
        "candidate_hash": "blake3:03cc71839428ceab088e386e31e6c72b7ca4a1e12c9309557efc76826dcb88cd",
        "telescope": {
          "clauses": [
            {
              "role": "formation",
              "expr": {
                "Pi": [
                  {
                    "Lib": 10
                  },
                  {
                    "Pi": [
                      {
                        "Var": 1
                      },
                      {
                        "Var": 1
                      }
                    ]
                  }
                ]
              }
            },
            {
              "role": "introduction",
              "expr": {
                "Lam": {
                  "Pi": [
                    {
                      "Var": 1
                    },
                    {
                      "Var": 2
                    }
                  ]
                }
              }
            },
            {
              "role": "formation",
              "expr": {
                "Pi": [
                  {
                    "Flat": {
                      "Var": 1
                    }
                  },
                  {
                    "Var": 1
                  }
                ]
              }
            },
            {
              "role": "introduction",
              "expr": {
                "App": [
                  {
                    "Lib": 10
                  },
                  {
                    "Var": 1
                  }
                ]
              }
            },
            {
              "role": "introduction",
              "expr": {
                "Lam": {
                  "Var": 1
                }
              }
            }
          ]
        }
      },
      {
        "step": 12,
        "candidate_hash": "blake3:0d06e3b14bfd7c1bd16d9f66039e016f84a6162ce85584f7c641753b833b1dcb",
        "telescope": {
          "clauses": [
            {
              "role": "formation",
              "expr": {
                "Pi": [
                  {
                    "Lib": 11
                  },
                  {
                    "Pi": [
                      {
                        "Var": 1
                      },
                      {
                        "Var": 1
                      }
                    ]
                  }
                ]
              }
            },
            {
              "role": "introduction",
              "expr": {
                "Lam": {
                  "App": [
                    {
                      "Lib": 11
                    },
                    {
                      "Var": 1
                    }
                  ]
                }
              }
            },
            {
              "role": "formation",
              "expr": {
                "Pi": [
                  {
                    "Var": 1
                  },
                  {
                    "Lib": 11
                  }
                ]
              }
            },
            {
              "role": "introduction",
              "expr": {
                "App": [
                  {
                    "Lib": 11
                  },
                  {
                    "App": [
                      {
                        "Var": 1
                      },
                      {
                        "Var": 2
                      }
                    ]
                  }
                ]
              }
            },
            {
              "role": "introduction",
              "expr": {
                "Lam": {
                  "Pi": [
                    {
                      "Var": 1
                    },
                    {
                      "Var": 2
                    }
                  ]
                }
              }
            },
            {
              "role": "formation",
              "expr": {
                "Pi": [
                  {
                    "Lib": 11
                  },
                  {
                    "Lib": 11
                  }
                ]
              }
            }
          ]
        }
      }
    ]
  },
  "near_misses": [],
  "stats": {
    "frontier_scanned": 1,
    "typed_prefixes": 1,
    "sound_prunes": 2,
    "heuristic_drops": 0
  }
}
