{
  "schema_version": 1,
  "run_id": "codex-claim-release-full-aggregation-open-band-clause-accept-rank-facts-long-rerun-v13",
  "step_index": 11,
  "accepted_utc": "2026-04-10T05:57:21.5720952Z",
  "compat": {
    "ast_schema_hash": "blake3:fc9be9ae20ab7277941ba7c98fcb9b7b0a78f699e595d3268656144a3f0b21bf",
    "type_rules_hash": "blake3:39c261a0e90bde0cfa2affee542db9a2519e4b8cd95c008e3fa0ed59cd38ac2e",
    "evaluator_hash": "blake3:dc3ad0d7c757a4b498bd4cfc56446e05af84df38049161883ab8592b18df4792",
    "search_semantics_hash": "blake3:f3572c8c8c9e01202de7df3840fda6eb4458c2f10104b509a36610d2f6dc80ea"
  },
  "objective": {
    "bar": {
      "num": 712,
      "den": 145
    },
    "exact_clause_kappa": 5,
    "bit_band": {
      "min": 79,
      "max": 79
    }
  },
  "accepted": {
    "candidate_hash": "blake3:03cc71839428ceab088e386e31e6c72b7ca4a1e12c9309557efc76826dcb88cd",
    "canonical_hash": "blake3:0b747d5eea40ef4cece4f40b64c7dbdff0db9ed74f209e5c6c79346f7165ae27",
    "bit_kappa": 79,
    "clause_kappa": 5,
    "nu": 26,
    "rho": {
      "num": 26,
      "den": 5
    },
    "overshoot": {
      "num": 42,
      "den": 145
    },
    "shape_fingerprint": "0x527926034486e22b",
    "support_fingerprint": "0x8c09e88b411da1f8"
  },
  "library_snapshot": {
    "window_depth": 2,
    "entries": [
      {
        "step": 9,
        "candidate_hash": "blake3:f57e3a5aa44003adb5f8054013e549e4f3065757d88922313478e8e445825491",
        "telescope": {
          "clauses": [
            {
              "role": "formation",
              "expr": {
                "Pi": [
                  {
                    "Lib": 8
                  },
                  {
                    "Lib": 7
                  }
                ]
              }
            },
            {
              "role": "introduction",
              "expr": {
                "App": [
                  {
                    "Lib": 5
                  },
                  {
                    "Var": 1
                  }
                ]
              }
            },
            {
              "role": "introduction",
              "expr": {
                "Lam": {
                  "App": [
                    {
                      "Lib": 8
                    },
                    {
                      "Lib": 7
                    }
                  ]
                }
              }
            },
            {
              "role": "formation",
              "expr": {
                "Pi": [
                  {
                    "Lib": 7
                  },
                  {
                    "Lib": 8
                  }
                ]
              }
            }
          ]
        }
      },
      {
        "step": 10,
        "candidate_hash": "blake3:93289041755cf4c4e0396029273822630028999d945359b10bb88e2376b9788e",
        "telescope": {
          "clauses": [
            {
              "role": "formation",
              "expr": {
                "Flat": {
                  "Var": 1
                }
              }
            },
            {
              "role": "formation",
              "expr": {
                "Sharp": {
                  "Var": 1
                }
              }
            },
            {
              "role": "formation",
              "expr": {
                "Disc": {
                  "Var": 1
                }
              }
            },
            {
              "role": "formation",
              "expr": {
                "Shape": {
                  "Var": 1
                }
              }
            }
          ]
        }
      }
    ]
  },
  "near_misses": [
    {
      "candidate_hash": "blake3:ace342655e362412ee5fc8befe735be0ebd93cc44f22b55569c0d844757fb46e",
      "canonical_hash": "blake3:50e5c5eddf9eb7c2ad91a25614ce01db18762615868d9730c445f600710a85ae",
      "bit_kappa": 88,
      "clause_kappa": 5,
      "nu": 26,
      "status": "bar_clear_higher_overshoot"
    },
    {
      "candidate_hash": "blake3:c051837c60e58b0136b8220d68245351877281dd4fb8e89b1277dc120a510c29",
      "canonical_hash": "blake3:af13d9d7c86b83bd562b04778b8b03756eeeedf472ed4b380609faca107cb246",
      "bit_kappa": 82,
      "clause_kappa": 5,
      "nu": 26,
      "status": "bar_clear_higher_overshoot"
    },
    {
      "candidate_hash": "blake3:44fd39229198578d38ad8102c7270eb4c161e7ce5062fe2112e218765daae979",
      "canonical_hash": "blake3:6703d5a0169e25be9a0d80a412d8e7bde1cee3a615a640a8970dda8724c7c6cf",
      "bit_kappa": 99,
      "clause_kappa": 5,
      "nu": 26,
      "status": "bar_clear_higher_overshoot"
    }
  ],
  "stats": {
    "frontier_scanned": 147,
    "typed_prefixes": 24,
    "sound_prunes": 250,
    "heuristic_drops": 0
  }
}
